{
  "enableAccessControl": false,
  "globalSettings": {
    "maxAggregateSize": 10000,
    "maxResultHits": 10000,
    "maxAnalyzedOffset": 1000,
    "aggregations": [
      {
        "name": "serviceType",
        "type": "terms",
        "field": "serviceType"
      },
      {
        "name": "service.displayName.keyword",
        "type": "terms",
        "field": "service.displayName.keyword"
      },
      {
        "name": "entityType",
        "type": "terms",
        "field": "entityType"
      },
      {
        "name": "tier.tagFQN",
        "type": "terms",
        "field": "tier.tagFQN"
      },
      {
        "name": "certification.tagLabel.tagFQN",
        "type": "terms",
        "field": "certification.tagLabel.tagFQN"
      },
      {
        "name": "owners.displayName.keyword",
        "type": "terms",
        "field": "owners.displayName.keyword"
      },
      {
        "name": "domain.displayName.keyword",
        "type": "terms",
        "field": "domain.displayName.keyword"
      },
      {
        "name": "tags.tagFQN",
        "type": "terms",
        "field": "tags.tagFQN"
      }
    ],
    "highlightFields": ["name", "displayName", "description", "displayName.ngram", "name.ngram"],
    "tagBoosts": [
      { "field": "tier.tagFQN", "tagFQN": "Tier.Tier1", "boost": 50.0 },
      { "field": "tier.tagFQN", "tagFQN": "Tier.Tier2", "boost": 30.0 },
      { "field": "tier.tagFQN", "tagFQN": "Tier.Tier3", "boost": 15.0 }
    ],
    "fieldValueBoosts": [
      {
        "field": "usageSummary.weeklyStats.count",
        "factor": 4.0,
        "modifier": "sqrt",
        "missing": 1,
        "condition": {
          "range": { "gt": 0 }
        }
      },
      {
        "field": "totalVotes",
        "factor": 3.0,
        "modifier": "ln1p",
        "missing": 0,
        "condition": {
          "range": { "gt": 0 }
        }
      }
    ]
  },
  "assetTypeConfigurations": [
    {
      "assetType": "table",
      "fields": {
        "name": 10.0,
        "displayName": 10.0,
        "description": 2.0,
        "fullyQualifiedName": 5.0,
        "fullyQualifiedNameParts": 5.0,
        "columns.name": 5.0,
        "columns.displayName": 5.0,
        "columns.description": 2.0,
        "columns.children.name": 3.0
      },
      "mustMatch": ["name", "fullyQualifiedName"],
      "shouldMatch": ["displayName", "description", "columns.name", "columns.description", "columns.children.name"],
      "highlightFields": ["name","description","displayName","columns.name","columns.description","columns.children.name"],
      "aggregations": [
        {
          "name": "database",
          "type": "terms",
          "field": "database.displayName.keyword"
        },
        {
          "name": "databaseSchema",
          "type": "terms",
          "field": "databaseSchema.displayName.keyword"
        },
        {
          "name": "columns",
          "type": "terms",
          "field": "columns.name.keyword"
        },
        {
          "name": "columnNames",
          "type": "terms",
          "field": "columnNames"
        },
        {
          "name": "tableType",
          "type": "terms",
          "field": "tableType"
        }
      ],
      "boosts": [
        { "field": "columns.name", "boost": 5.0 },
        { "field": "columns.displayName", "boost": 5.0 },
        { "field": "columns.description", "boost": 2.0 },
        { "field": "columns.children.name", "boost": 3.0 }
      ],
      "scoreMode": "sum",
      "boostMode": "multiply"
    },
    {
      "assetType": "pipeline",
      "fields": {
        "name": 10.0,
        "displayName": 10.0,
        "description": 2.0,
        "fullyQualifiedName": 5.0,
        "fullyQualifiedNameParts": 5.0,
        "tasks.name": 8.0,
        "tasks.description": 1.0
      },
      "mustMatch": ["name", "fullyQualifiedName"],
      "shouldMatch": ["displayName", "description", "tasks.name", "tasks.description"],
      "highlightFields": ["tasks.name", "tasks.description"],
      "aggregations": [
        {
          "name": "tasks",
          "type": "terms",
          "field": "tasks.displayName.keyword"
        }
      ],
      "boosts": [
        { "field": "tasks.name", "boost": 8.0 },
        { "field": "tasks.description", "boost": 1.0 }
      ],
      "scoreMode": "sum",
      "boostMode": "multiply"
    },
    {
      "assetType": "mlmodel",
      "fields": {
        "name": 10.0,
        "displayName": 10.0,
        "description": 2.0,
        "fullyQualifiedName": 5.0,
        "fullyQualifiedNameParts": 5.0,
        "mlFeatures.name": 8.0,
        "mlFeatures.description": 1.0
      },
      "mustMatch": ["name", "fullyQualifiedName"],
      "shouldMatch": ["displayName", "description", "mlFeatures.name", "mlFeatures.description"],
      "highlightFields": ["mlFeatures.name", "mlFeatures.description"],
      "boosts": [
        { "field": "mlFeatures.name", "boost": 8.0 },
        { "field": "mlFeatures.description", "boost": 1.0 }
      ],
      "scoreMode": "sum",
      "boostMode": "multiply"
    },
    {
      "assetType": "topic",
      "fields": {
        "name": 10.0,
        "displayName": 10.0,
        "description": 2.0,
        "fullyQualifiedName": 5.0,
        "fullyQualifiedNameParts": 5.0,
        "messageSchema.schemaText": 7.0,
        "messageSchema.schemaFields.name.keyword": 5.0,
        "messageSchema.schemaFields.description": 1.0,
        "messageSchema.schemaFields.children.name": 7.0,
        "messageSchema.schemaFields.children.keyword": 5.0
      },
      "mustMatch": ["name", "fullyQualifiedName"],
      "shouldMatch": [
        "displayName",
        "description",
        "messageSchema.schemaText",
        "messageSchema.schemaFields.name.keyword",
        "messageSchema.schemaFields.description",
        "messageSchema.schemaFields.children.name"
      ],
      "highlightFields": [],
      "aggregations": [
        {
          "name": "messageSchema",
          "type": "terms",
          "field": "messageSchema.schemaText.keyword"
        },
        {
          "name": "schemaFieldNames",
          "type": "terms",
          "field": "schemaFieldNames"
        }
      ],
      "boosts": [
        { "field": "messageSchema.schemaText", "boost": 7.0 },
        { "field": "messageSchema.schemaFields.name.keyword", "boost": 5.0 },
        { "field": "messageSchema.schemaFields.description", "boost": 1.0 },
        { "field": "messageSchema.schemaFields.children.name", "boost": 7.0 },
        { "field": "messageSchema.schemaFields.children.keyword", "boost": 5.0 }
      ],
      "scoreMode": "sum",
      "boostMode": "multiply"
    },
    {
      "assetType": "dashboard",
      "fields": {
        "name": 10.0,
        "displayName": 10.0,
        "description": 2.0,
        "fullyQualifiedName": 5.0,
        "fullyQualifiedNameParts": 5.0,
        "charts.name": 7.0,
        "charts.displayName": 5.0
      },
      "mustMatch": ["name", "fullyQualifiedName"],
      "shouldMatch": [
        "displayName",
        "description",
        "charts.name",
        "charts.displayName"
      ],
      "highlightFields": [],
      "aggregations": [
        {
          "name": "dataModels.displayName.keyword",
          "type": "terms",
          "field": "dataModels.displayName.keyword"
        },
        {
          "name": "project.keyword",
          "type": "terms",
          "field": "project.keyword"
        },
        {
          "name": "charts.displayName.keyword",
          "type": "terms",
          "field": "charts.displayName.keyword"
        }
      ],
      "boosts": [
        { "field": "charts.name", "boost": 2.0 },
        { "field": "charts.description", "boost": 5.0 }
      ],
      "scoreMode": "sum",
      "boostMode": "multiply"
    },
    {
      "assetType": "dashboardDataModel",
      "fields": {
        "name": 10.0,
        "displayName": 10.0,
        "description": 2.0,
        "fullyQualifiedName": 5.0,
        "fullyQualifiedNameParts": 5.0
      },
      "mustMatch": ["name", "fullyQualifiedName", "query", "query.ngram"],
      "shouldMatch": ["columns.name", "columns.description", "columns.children.name", "columns.displayName"],
      "highlightFields": [],
      "aggregations": [
        {
          "name": "dataModelType",
          "type": "terms",
          "field": "dataModelType"
        },
        {
            "name": "project.keyword",
            "type": "terms",
            "field": "project.keyword"
        },
        {
            "name": "columnNames",
            "type": "terms",
            "field": "columnNames"
        },
        {
          "name": "columns.name.keyword",
          "type": "terms",
          "field": "columns.name.keyword"
        }
      ],
      "boosts": [
      ],
      "scoreMode": "sum",
      "boostMode": "multiply"
    },
    {
      "assetType": "container",
      "fields": {
        "name": 10.0,
        "displayName": 10.0,
        "description": 2.0,
        "fullyQualifiedName": 5.0,
        "fullyQualifiedNameParts": 5.0
      },
      "mustMatch": ["name", "fullyQualifiedName"],
      "shouldMatch": [
        "classfiication.name",
        "description"
      ],
      "highlightFields": ["dataModel.columns.name", "dataModel.columns.description", "dataModel.columns.children.name"],
      "aggregations": [
        {
          "name": "dataModel.columns.name.keyword",
          "type": "terms",
          "field": "dataModel.columns.name.keyword"
        },
        {
          "name": "columnNames",
          "type": "terms",
          "field": "columnNames"
        }
      ],
      "boosts": [
      ],
      "scoreMode": "sum",
      "boostMode": "multiply"
    },
    {
      "assetType": "storedProcedure",
      "fields": {
        "name": 10.0,
        "displayName": 10.0,
        "description": 2.0,
        "fullyQualifiedName": 5.0,
        "fullyQualifiedNameParts": 5.0
      },